Introduction to Triggers
=========================
a trigger is a special type of stored program that automatically executes in a response to a specific event like insert,update,delete occurring on a specified table unlike a stored procedure  a trigger is never called directly.the database engine invokes it automatically when the trigger event happens

syntax
=======
DELIMITER //
CREATE TRIGGER TRIGGER_NAME{BEFORE | AFTER}{INSERT|UPDATE|DELETE}
ON TABLE_NAME
FOR EACH ROW
BEGIN
      ---TRIGGER LOGIC
      ---USE NEW.COLUMN_NAME FOR INSERT/UPDATE VALUES
      ---UED OLD.COLUMN_NAME FOR DELETED/PREVIOUS VALUE
END //

DELIMITER ;

Day_18_MySQL
=============

mysql> use pfs04;
Database changed
mysql> show tables
    -> ;
+-----------------+
| Tables_in_pfs04 |
+-----------------+
| city            |
| country         |
| countrylanguage |
| department      |
| employee        |
| employees       |
| project         |
+-----------------+
7 rows in set (0.01 sec)

mysql> select * from employees;
+--------+----------+------------+----------+------------+-----------+
| emp_id | emp_name | department | salary   | experience | city      |
+--------+----------+------------+----------+------------+-----------+
|    101 | Rahul    | IT         | 65000.00 |          5 | Hyderabad |
|    102 | Priya    | HR         | 45000.00 |          3 | Chennai   |
|    103 | Amit     | Finance    | 70000.00 |          6 | Bangalore |
|    104 | Sneha    | IT         | 80000.00 |          8 | Hyderabad |
|    105 | Kiran    | Sales      | 40000.00 |          2 | Pune      |
|    106 | Ravi     | HR         | 50000.00 |          4 | Mumbai    |
|    107 | Anjali   | IT         | 90000.00 |         10 | Delhi     |
|    108 | Suresh   | Finance    | 55000.00 |          5 | Chennai   |
|    109 | Divya    | Sales      | 48000.00 |          3 | Hyderabad |
|    110 | Vikram   | IT         | 75000.00 |          7 | Bangalore |
+--------+----------+------------+----------+------------+-----------+
10 rows in set (0.00 sec)

mysql> delimiter //
mysql> create procedure departmentwisecount()
    -> begin
    -> select department,count(*) as total_employees from employees
    -> group by department;
    -> end //
Query OK, 0 rows affected (0.01 sec)

mysql> delimiter ;
mysql> call departmentwisecount();
+------------+-----------------+
| department | total_employees |
+------------+-----------------+
| IT         |               4 |
| HR         |               2 |
| Finance    |               2 |
| Sales      |               2 |
+------------+-----------------+
4 rows in set (0.00 sec)

Query OK, 0 rows affected (0.02 sec)

mysql> SHOW PROCEDURE STATUS
    -> WHERE Db = 'PFS04';
+-------+---------------------+-----------+----------------+---------------------+---------------------+---------------+---------+----------------------+----------------------+--------------------+
| Db    | Name                | Type      | Definer        | Modified            | Created             | Security_type | Comment | character_set_client | collation_connection | Database Collation |
+-------+---------------------+-----------+----------------+---------------------+---------------------+---------------+---------+----------------------+----------------------+--------------------+
| pfs04 | departmentwisecount | PROCEDURE | root@localhost | 2026-08-05 09:10:22 | 2026-08-05 09:10:22 | DEFINER       |         | utf8mb4              | utf8mb4_0900_ai_ci   | utf8mb4_0900_ai_ci |
| pfs04 | GETALLEMP           | PROCEDURE | root@localhost | 2026-08-04 10:55:28 | 2026-08-04 10:55:28 | DEFINER       |         | utf8mb4              | utf8mb4_0900_ai_ci   | utf8mb4_0900_ai_ci |
| pfs04 | GETALLEMPNAME       | PROCEDURE | root@localhost | 2026-08-04 11:05:56 | 2026-08-04 11:05:56 | DEFINER       |         | utf8mb4              | utf8mb4_0900_ai_ci   | utf8mb4_0900_ai_ci |
| pfs04 | GETALLIT            | PROCEDURE | root@localhost | 2026-08-04 11:00:29 | 2026-08-04 11:00:29 | DEFINER       |         | utf8mb4              | utf8mb4_0900_ai_ci   | utf8mb4_0900_ai_ci |
+-------+---------------------+-----------+----------------+---------------------+---------------------+---------------+---------+----------------------+----------------------+--------------------+
4 rows in set (0.01 sec)

mysql> -- IN PARAMETER
mysql> -- GET EMPLOYEE ID
mysql> DELIMITER //
mysql> CREATE PROCEDURE getEmployeeById(IN eid INT)
    -> BEGIN
    -> SELECT * FROM EMPLOYEES WHERE EMP_ID=EID;
    -> END //
Query OK, 0 rows affected (0.02 sec)

mysql> DELIMITER ;
mysql> CALL getEmployeeById(101);
+--------+----------+------------+----------+------------+-----------+
| emp_id | emp_name | department | salary   | experience | city      |
+--------+----------+------------+----------+------------+-----------+
|    101 | Rahul    | IT         | 65000.00 |          5 | Hyderabad |
+--------+----------+------------+----------+------------+-----------+
1 row in set (0.00 sec)

Query OK, 0 rows affected (0.01 sec)

mysql> -- GET EMPLOYEES BY DEPARTMENT
mysql> DELIMITER //
mysql> CREATE PROCEDURE GETEMPLOYEEDEPT(IN DEPTNAME VARCHAR(30))
    -> BEGIN
    -> SELECT * FROM EMPLOYEES WHERE DEPARTMENT = DEPTNAME;
    -> END //
Query OK, 0 rows affected (0.01 sec)

mysql> DELIMITER ;
mysql> CALL GETEMPLOYEEDEPT('IT');
+--------+----------+------------+----------+------------+-----------+
| emp_id | emp_name | department | salary   | experience | city      |
+--------+----------+------------+----------+------------+-----------+
|    101 | Rahul    | IT         | 65000.00 |          5 | Hyderabad |
|    104 | Sneha    | IT         | 80000.00 |          8 | Hyderabad |
|    107 | Anjali   | IT         | 90000.00 |         10 | Delhi     |
|    110 | Vikram   | IT         | 75000.00 |          7 | Bangalore |
+--------+----------+------------+----------+------------+-----------+
4 rows in set (0.00 sec)

Query OK, 0 rows affected (0.03 sec)

mysql> --
mysql> --
mysql> DELIMITER //
mysql> CREATE PROCEDURE DEPTEXPERIENCE(IN DEPT VARCHAR(30), IN EXP INT)
    -> BEGIN
    -> SELECT * FROM EMPLOYEES
    -> WHERE DEPARTMENT = DEPT AND EXPERIENCE > EXP;
    -> END //
Query OK, 0 rows affected (0.01 sec)

mysql> DELIMITER ;
mysql> CALL DEPTEXPERIENCE('IT',5);
+--------+----------+------------+----------+------------+-----------+
| emp_id | emp_name | department | salary   | experience | city      |
+--------+----------+------------+----------+------------+-----------+
|    104 | Sneha    | IT         | 80000.00 |          8 | Hyderabad |
|    107 | Anjali   | IT         | 90000.00 |         10 | Delhi     |
|    110 | Vikram   | IT         | 75000.00 |          7 | Bangalore |
+--------+----------+------------+----------+------------+-----------+
3 rows in set (0.00 sec)

Query OK, 0 rows affected (0.02 sec)

mysql> DELIMITER //
mysql> CREATE PROCEDURE SALRANGE(IN MINSAL DECIMAL(10,2), IN MAXSAL DECIMAL(10,2))
    -> BEGIN
    -> SELECT * FROM EMPLOYEES WHERE SALARY BETWEEN MINSAL AND MAXSAL;
    -> END //
Query OK, 0 rows affected (0.01 sec)

mysql> DELIMITER ;
mysql> CALL  SALRANGE(40000,70000);
+--------+----------+------------+----------+------------+-----------+
| emp_id | emp_name | department | salary   | experience | city      |
+--------+----------+------------+----------+------------+-----------+
|    101 | Rahul    | IT         | 65000.00 |          5 | Hyderabad |
|    102 | Priya    | HR         | 45000.00 |          3 | Chennai   |
|    103 | Amit     | Finance    | 70000.00 |          6 | Bangalore |
|    105 | Kiran    | Sales      | 40000.00 |          2 | Pune      |
|    106 | Ravi     | HR         | 50000.00 |          4 | Mumbai    |
|    108 | Suresh   | Finance    | 55000.00 |          5 | Chennai   |
|    109 | Divya    | Sales      | 48000.00 |          3 | Hyderabad |
+--------+----------+------------+----------+------------+-----------+
7 rows in set (0.00 sec)

Query OK, 0 rows affected (0.04 sec)

mysql> -- OUT PARAMETER
mysql> DELIMITER //
mysql> CREATE PROCEDURE TOTALEMPLOYEES(OUT TOTAL INT)
    -> BEGIN
    -> SELECT COUNT(*) INTO TOTAL FROM EMPLOYEES;
    -> END //
Query OK, 0 rows affected (0.01 sec)

mysql> DELIMITER ;
mysql> CALL TOTALEMPLOYEES(@TOTAL);
Query OK, 1 row affected (0.01 sec)

mysql> SELECT @TOTAL;
+--------+
| @TOTAL |
+--------+
|     10 |
+--------+
1 row in set (0.00 sec)

mysql> DELIMITER //
mysql> CREATE PROCEDURE TOTALITEMPLOYEES(OUT TOTAL INT)
    -> BEGIN
    -> SELECT COUNT(*) INTO TOTAL FROM EMPLOYEES WHERE DEPARTMENT = 'IT';
    -> END //
Query OK, 0 rows affected (0.02 sec)

mysql> DELIMITER ;
mysql> CALL TOTALITEMPLOYEES(@TOTAL);
Query OK, 1 row affected (0.00 sec)

mysql> SELECT @TOTAL;
+--------+
| @TOTAL |
+--------+
|      4 |
+--------+
1 row in set (0.00 sec)

mysql> -- INOUT PARAMETER
mysql> DELIMITER //
mysql> CREATE PROCEDURE ADDBONUS(IN EID INT, OUT BONUS DECIMAL(10,2))
    -> BEGIN
    -> UPDATE EMPLOYEES SET SALARY = SALARY + BONUS WHERE EMP_ID = EID;
    -> SELECT SALARY INTO BONUS FROM EMPLOYEES WHERE EMP_ID = EID;
    -> END //
Query OK, 0 rows affected (0.01 sec)

mysql> DELIMITER ;
mysql> SET @B=5000;
Query OK, 0 rows affected (0.00 sec)

mysql> CALL ADDBONUS(101,@B);
Query OK, 1 row affected (0.01 sec)

mysql> SELECT @B;
+------+
| @B   |
+------+
| NULL |
+------+
1 row in set (0.00 sec)

mysql> DROP PROCEDURE ADDBONUS;
Query OK, 0 rows affected (0.01 sec)

mysql> SELECT * FROM EMPLOYEES;
+--------+----------+------------+----------+------------+-----------+
| emp_id | emp_name | department | salary   | experience | city      |
+--------+----------+------------+----------+------------+-----------+
|    101 | Rahul    | IT         |     NULL |          5 | Hyderabad |
|    102 | Priya    | HR         | 45000.00 |          3 | Chennai   |
|    103 | Amit     | Finance    | 70000.00 |          6 | Bangalore |
|    104 | Sneha    | IT         | 80000.00 |          8 | Hyderabad |
|    105 | Kiran    | Sales      | 40000.00 |          2 | Pune      |
|    106 | Ravi     | HR         | 50000.00 |          4 | Mumbai    |
|    107 | Anjali   | IT         | 90000.00 |         10 | Delhi     |
|    108 | Suresh   | Finance    | 55000.00 |          5 | Chennai   |
|    109 | Divya    | Sales      | 48000.00 |          3 | Hyderabad |
|    110 | Vikram   | IT         | 75000.00 |          7 | Bangalore |
+--------+----------+------------+----------+------------+-----------+
10 rows in set (0.00 sec)

mysql> UPDATE EMPLOYEES SET SALARY = 80000 WHERE EMP_ID = 101;
Query OK, 1 row affected (0.01 sec)
Rows matched: 1  Changed: 1  Warnings: 0

mysql> SELECT * FROM EMPLOYEES;
+--------+----------+------------+----------+------------+-----------+
| emp_id | emp_name | department | salary   | experience | city      |
+--------+----------+------------+----------+------------+-----------+
|    101 | Rahul    | IT         | 80000.00 |          5 | Hyderabad |
|    102 | Priya    | HR         | 45000.00 |          3 | Chennai   |
|    103 | Amit     | Finance    | 70000.00 |          6 | Bangalore |
|    104 | Sneha    | IT         | 80000.00 |          8 | Hyderabad |
|    105 | Kiran    | Sales      | 40000.00 |          2 | Pune      |
|    106 | Ravi     | HR         | 50000.00 |          4 | Mumbai    |
|    107 | Anjali   | IT         | 90000.00 |         10 | Delhi     |
|    108 | Suresh   | Finance    | 55000.00 |          5 | Chennai   |
|    109 | Divya    | Sales      | 48000.00 |          3 | Hyderabad |
|    110 | Vikram   | IT         | 75000.00 |          7 | Bangalore |
+--------+----------+------------+----------+------------+-----------+
10 rows in set (0.00 sec)

mysql> DELIMITER //
mysql> CREATE PROCEDURE ADDBONUS(IN EID INT, OUT BONUS DECIMAL(10,2))
    -> BEGIN
    -> UPDATE EMPLOYEES SET SALARY = SALARY + BONUS WHERE EMP_ID = EID;
    -> SELECT SALARY INTO BONUS FROM EMPLOYEES WHERE EMP_ID = EID;
    -> END //
Query OK, 0 rows affected (0.01 sec)

mysql> DELIMITER ;
mysql> SET @B=5000;
Query OK, 0 rows affected (0.00 sec)

mysql> CALL ADDBONUS(101,@B);
Query OK, 1 row affected (0.01 sec)

mysql> SELECT @B;
+------+
| @B   |
+------+
| NULL |
+------+
1 row in set (0.00 sec)

mysql> DROP PROCEDURE ADDBONUS;
Query OK, 0 rows affected (0.01 sec)

mysql> DELIMITER //
mysql> CREATE PROCEDURE ADDBONUS(IN EID INT, INOUT BONUS DECIMAL(10,2))
    -> BEGIN
    -> UPDATE EMPLOYEES SET SALARY = SALARY + BONUS WHERE EMP_ID = EID;
    -> SELECT SALARY INTO BONUS FROM EMPLOYEES WHERE EMP_ID = EID;
    -> END //
Query OK, 0 rows affected (0.01 sec)

mysql> DELIMITER ;
mysql> SET @B=5000;
Query OK, 0 rows affected (0.00 sec)

mysql> CALL ADDBONUS(101,@B);
Query OK, 1 row affected (0.00 sec)

mysql> SELECT @B;
+------+
| @B   |
+------+
| NULL |
+------+
1 row in set (0.00 sec)

mysql> SELECT * FROM EMPLOYEES;
+--------+----------+------------+----------+------------+-----------+
| emp_id | emp_name | department | salary   | experience | city      |
+--------+----------+------------+----------+------------+-----------+
|    101 | Rahul    | IT         |     NULL |          5 | Hyderabad |
|    102 | Priya    | HR         | 45000.00 |          3 | Chennai   |
|    103 | Amit     | Finance    | 70000.00 |          6 | Bangalore |
|    104 | Sneha    | IT         | 80000.00 |          8 | Hyderabad |
|    105 | Kiran    | Sales      | 40000.00 |          2 | Pune      |
|    106 | Ravi     | HR         | 50000.00 |          4 | Mumbai    |
|    107 | Anjali   | IT         | 90000.00 |         10 | Delhi     |
|    108 | Suresh   | Finance    | 55000.00 |          5 | Chennai   |
|    109 | Divya    | Sales      | 48000.00 |          3 | Hyderabad |
|    110 | Vikram   | IT         | 75000.00 |          7 | Bangalore |
+--------+----------+------------+----------+------------+-----------+
10 rows in set (0.00 sec)

mysql> UPDATE EMPLOYEES SET SALARY = 80000 WHERE EMP_ID = 101;
Query OK, 1 row affected (0.01 sec)
Rows matched: 1  Changed: 1  Warnings: 0

mysql> SELECT * FROM EMPLOYEES;
+--------+----------+------------+----------+------------+-----------+
| emp_id | emp_name | department | salary   | experience | city      |
+--------+----------+------------+----------+------------+-----------+
|    101 | Rahul    | IT         | 80000.00 |          5 | Hyderabad |
|    102 | Priya    | HR         | 45000.00 |          3 | Chennai   |
|    103 | Amit     | Finance    | 70000.00 |          6 | Bangalore |
|    104 | Sneha    | IT         | 80000.00 |          8 | Hyderabad |
|    105 | Kiran    | Sales      | 40000.00 |          2 | Pune      |
|    106 | Ravi     | HR         | 50000.00 |          4 | Mumbai    |
|    107 | Anjali   | IT         | 90000.00 |         10 | Delhi     |
|    108 | Suresh   | Finance    | 55000.00 |          5 | Chennai   |
|    109 | Divya    | Sales      | 48000.00 |          3 | Hyderabad |
|    110 | Vikram   | IT         | 75000.00 |          7 | Bangalore |
+--------+----------+------------+----------+------------+-----------+
10 rows in set (0.00 sec)

mysql> SHOW PROCEDURE STATUS 
    -> WHERE DB = 'PFS04';
+-------+---------------------+-----------+----------------+---------------------+---------------------+---------------+---------+----------------------+----------------------+--------------------+
| Db    | Name                | Type      | Definer        | Modified            | Created             | Security_type | Comment | character_set_client | collation_connection | Database Collation |
+-------+---------------------+-----------+----------------+---------------------+---------------------+---------------+---------+----------------------+----------------------+--------------------+
| pfs04 | ADDBONUS            | PROCEDURE | root@localhost | 2026-08-05 10:10:53 | 2026-08-05 10:10:53 | DEFINER       |         | utf8mb4              | utf8mb4_0900_ai_ci   | utf8mb4_0900_ai_ci |
| pfs04 | departmentwisecount | PROCEDURE | root@localhost | 2026-08-05 09:10:22 | 2026-08-05 09:10:22 | DEFINER       |         | utf8mb4              | utf8mb4_0900_ai_ci   | utf8mb4_0900_ai_ci |
| pfs04 | DEPTEXPERIENCE      | PROCEDURE | root@localhost | 2026-08-05 09:37:50 | 2026-08-05 09:37:50 | DEFINER       |         | utf8mb4              | utf8mb4_0900_ai_ci   | utf8mb4_0900_ai_ci |
| pfs04 | GETALLEMP           | PROCEDURE | root@localhost | 2026-08-04 10:55:28 | 2026-08-04 10:55:28 | DEFINER       |         | utf8mb4              | utf8mb4_0900_ai_ci   | utf8mb4_0900_ai_ci |
| pfs04 | GETALLEMPNAME       | PROCEDURE | root@localhost | 2026-08-04 11:05:56 | 2026-08-04 11:05:56 | DEFINER       |         | utf8mb4              | utf8mb4_0900_ai_ci   | utf8mb4_0900_ai_ci |
| pfs04 | GETALLIT            | PROCEDURE | root@localhost | 2026-08-04 11:00:29 | 2026-08-04 11:00:29 | DEFINER       |         | utf8mb4              | utf8mb4_0900_ai_ci   | utf8mb4_0900_ai_ci |
| pfs04 | getEmployeeById     | PROCEDURE | root@localhost | 2026-08-05 09:20:21 | 2026-08-05 09:20:21 | DEFINER       |         | utf8mb4              | utf8mb4_0900_ai_ci   | utf8mb4_0900_ai_ci |
| pfs04 | GETEMPLOYEEDEPT     | PROCEDURE | root@localhost | 2026-08-05 09:22:57 | 2026-08-05 09:22:57 | DEFINER       |         | utf8mb4              | utf8mb4_0900_ai_ci   | utf8mb4_0900_ai_ci |
| pfs04 | SALRANGE            | PROCEDURE | root@localhost | 2026-08-05 09:39:50 | 2026-08-05 09:39:50 | DEFINER       |         | utf8mb4              | utf8mb4_0900_ai_ci   | utf8mb4_0900_ai_ci |
| pfs04 | TOTALEMPLOYEES      | PROCEDURE | root@localhost | 2026-08-05 09:43:12 | 2026-08-05 09:43:12 | DEFINER       |         | utf8mb4              | utf8mb4_0900_ai_ci   | utf8mb4_0900_ai_ci |
| pfs04 | TOTALITEMPLOYEES    | PROCEDURE | root@localhost | 2026-08-05 09:46:03 | 2026-08-05 09:46:03 | DEFINER       |         | utf8mb4              | utf8mb4_0900_ai_ci   | utf8mb4_0900_ai_ci |
+-------+---------------------+-----------+----------------+---------------------+---------------------+---------------+---------+----------------------+----------------------+--------------------+
11 rows in set (0.00 sec)

mysql> DROP PROCEDURE ADDBONUS;
Query OK, 0 rows affected (0.01 sec)

mysql> SHOW PROCEDURE STATUS 
    -> WHERE DB = 'PFS04';
+-------+---------------------+-----------+----------------+---------------------+---------------------+---------------+---------+----------------------+----------------------+--------------------+
| Db    | Name                | Type      | Definer        | Modified            | Created             | Security_type | Comment | character_set_client | collation_connection | Database Collation |
+-------+---------------------+-----------+----------------+---------------------+---------------------+---------------+---------+----------------------+----------------------+--------------------+
| pfs04 | departmentwisecount | PROCEDURE | root@localhost | 2026-08-05 09:10:22 | 2026-08-05 09:10:22 | DEFINER       |         | utf8mb4              | utf8mb4_0900_ai_ci   | utf8mb4_0900_ai_ci |
| pfs04 | DEPTEXPERIENCE      | PROCEDURE | root@localhost | 2026-08-05 09:37:50 | 2026-08-05 09:37:50 | DEFINER       |         | utf8mb4              | utf8mb4_0900_ai_ci   | utf8mb4_0900_ai_ci |
| pfs04 | GETALLEMP           | PROCEDURE | root@localhost | 2026-08-04 10:55:28 | 2026-08-04 10:55:28 | DEFINER       |         | utf8mb4              | utf8mb4_0900_ai_ci   | utf8mb4_0900_ai_ci |
| pfs04 | GETALLEMPNAME       | PROCEDURE | root@localhost | 2026-08-04 11:05:56 | 2026-08-04 11:05:56 | DEFINER       |         | utf8mb4              | utf8mb4_0900_ai_ci   | utf8mb4_0900_ai_ci |
| pfs04 | GETALLIT            | PROCEDURE | root@localhost | 2026-08-04 11:00:29 | 2026-08-04 11:00:29 | DEFINER       |         | utf8mb4              | utf8mb4_0900_ai_ci   | utf8mb4_0900_ai_ci |
| pfs04 | getEmployeeById     | PROCEDURE | root@localhost | 2026-08-05 09:20:21 | 2026-08-05 09:20:21 | DEFINER       |         | utf8mb4              | utf8mb4_0900_ai_ci   | utf8mb4_0900_ai_ci |
| pfs04 | GETEMPLOYEEDEPT     | PROCEDURE | root@localhost | 2026-08-05 09:22:57 | 2026-08-05 09:22:57 | DEFINER       |         | utf8mb4              | utf8mb4_0900_ai_ci   | utf8mb4_0900_ai_ci |
| pfs04 | SALRANGE            | PROCEDURE | root@localhost | 2026-08-05 09:39:50 | 2026-08-05 09:39:50 | DEFINER       |         | utf8mb4              | utf8mb4_0900_ai_ci   | utf8mb4_0900_ai_ci |
| pfs04 | TOTALEMPLOYEES      | PROCEDURE | root@localhost | 2026-08-05 09:43:12 | 2026-08-05 09:43:12 | DEFINER       |         | utf8mb4              | utf8mb4_0900_ai_ci   | utf8mb4_0900_ai_ci |
| pfs04 | TOTALITEMPLOYEES    | PROCEDURE | root@localhost | 2026-08-05 09:46:03 | 2026-08-05 09:46:03 | DEFINER       |         | utf8mb4              | utf8mb4_0900_ai_ci   | utf8mb4_0900_ai_ci |
+-------+---------------------+-----------+----------------+---------------------+---------------------+---------------+---------+----------------------+----------------------+--------------------+
10 rows in set (0.00 sec)

mysql> DELIMITER //
mysql> CREATE PROCEDURE ADDBONUS(IN EID INT, INOUT BONUS DECIMAL(10,2))
    -> BEGIN
    -> UPDATE EMPLOYEES SET SALARY=SALARY+5000 WHERE EMP_ID = EID;
    -> ^C
mysql> CREATE PROCEDURE ADDBONUS(IN EID INT, INOUT BONUS DECIMAL(10,2))
    -> BEGIN
    -> UPDATE EMPLOYEES SET SALARY=SALARY+BONUS WHERE EMP_ID = EID;
    -> SELECT SALARY INTO BONUS FROM EMPLOYEES WHERE EMP_ID = EID;
    -> END //
Query OK, 0 rows affected (0.01 sec)

mysql> DELIMITER ;
mysql> SET @b = 5000;
Query OK, 0 rows affected (0.00 sec)

mysql> CALL ADDBONUS(101,@b);
Query OK, 1 row affected (0.01 sec)

mysql> select @b;
+----------+
| @b       |
+----------+
| 85000.00 |
+----------+
1 row in set (0.00 sec)

mysql> SELECT * FROM EMPLOYEES;
+--------+----------+------------+----------+------------+-----------+
| emp_id | emp_name | department | salary   | experience | city      |
+--------+----------+------------+----------+------------+-----------+
|    101 | Rahul    | IT         | 85000.00 |          5 | Hyderabad |
|    102 | Priya    | HR         | 45000.00 |          3 | Chennai   |
|    103 | Amit     | Finance    | 70000.00 |          6 | Bangalore |
|    104 | Sneha    | IT         | 80000.00 |          8 | Hyderabad |
|    105 | Kiran    | Sales      | 40000.00 |          2 | Pune      |
|    106 | Ravi     | HR         | 50000.00 |          4 | Mumbai    |
|    107 | Anjali   | IT         | 90000.00 |         10 | Delhi     |
|    108 | Suresh   | Finance    | 55000.00 |          5 | Chennai   |
|    109 | Divya    | Sales      | 48000.00 |          3 | Hyderabad |
|    110 | Vikram   | IT         | 75000.00 |          7 | Bangalore |
+--------+----------+------------+----------+------------+-----------+
10 rows in set (0.00 sec)

Introduction to Triggers
==========================
A trigger is a special type of stored program that automatically executes in a response to a specific event INSERT,UPDATE OR DELETE ---> Occurring on a specified table. unlike a stored procedure. a trigger is never called directly. the database engine invokes it automatically when the trigger event happens.

syntax:
=======
DELIMITER //
CREATE TRIGGER trigger-name{BEFORE|AFTER}{insert|update|delete}
ON TABLE-NAME
FOR EACH ROW
BEGIN
   -- trigger logic
   -- use NEW.column-name for inserted/updated values
   -- use OLD.column-name for deleted/previous values
END //
DELIMITER ;

mysql> CREATE TABLE Employees (
    ->     emp_id INT PRIMARY KEY,
    ->     emp_name VARCHAR(50),
    ->     department VARCHAR(30),
    ->     salary DECIMAL(10,2),
    ->     experience INT,
    ->     city VARCHAR(30)
    -> );
ERROR 1050 (42S01): Table 'employees' already exists
mysql> 
mysql> 
mysql> 
mysql> INSERT INTO Employees VALUES
    -> (101,'Rahul','IT',65000,5,'Hyderabad'),
    -> (102,'Priya','HR',45000,3,'Chennai'),
    -> (103,'Amit','Finance',70000,6,'Bangalore'),
    -> (104,'Sneha','IT',80000,8,'Hyderabad'),
    -> (105,'Kiran','Sales',40000,2,'Pune');
ERROR 1062 (23000): Duplicate entry '101' for key 'employees.PRIMARY'
mysql> 
mysql> 
mysql> 
mysql> 
mysql> CREATE TABLE Employee_Audit(
    ->     audit_id INT AUTO_INCREMENT PRIMARY KEY,
    ->     emp_id INT,
    ->     action_type VARCHAR(20),
    ->     old_salary DECIMAL(10,2),
    ->     new_salary DECIMAL(10,2),
    ->     action_time DATETIME
    -> );
Query OK, 0 rows affected (0.03 sec)

mysql> show tables;
+-----------------+
| Tables_in_pfs04 |
+-----------------+
| city            |
| country         |
| countrylanguage |
| department      |
| employee        |
| employee_audit  |
| employees       |
| project         |
+-----------------+
8 rows in set (0.00 sec)

mysql> drop table employees;
Query OK, 0 rows affected (0.02 sec)

mysql> drop table employee_audit;
Query OK, 0 rows affected (0.02 sec)

mysql> CREATE TABLE Employees (
    ->     emp_id INT PRIMARY KEY,
    ->     emp_name VARCHAR(50),
    ->     department VARCHAR(30),
    ->     salary DECIMAL(10,2),
    ->     experience INT,
    ->     city VARCHAR(30)
    -> );
Query OK, 0 rows affected (0.01 sec)

mysql> 
mysql> 
mysql> 
mysql> INSERT INTO Employees VALUES
    -> (101,'Rahul','IT',65000,5,'Hyderabad'),
    -> (102,'Priya','HR',45000,3,'Chennai'),
    -> (103,'Amit','Finance',70000,6,'Bangalore'),
    -> (104,'Sneha','IT',80000,8,'Hyderabad'),
    -> (105,'Kiran','Sales',40000,2,'Pune');
Query OK, 5 rows affected (0.00 sec)
Records: 5  Duplicates: 0  Warnings: 0

mysql> 
mysql> 
mysql> 
mysql> 
mysql> CREATE TABLE Employee_Audit(
    ->     audit_id INT AUTO_INCREMENT PRIMARY KEY,
    ->     emp_id INT,
    ->     action_type VARCHAR(20),
    ->     old_salary DECIMAL(10,2),
    ->     new_salary DECIMAL(10,2),
    ->     action_time DATETIME
    -> );
Query OK, 0 rows affected (0.02 sec)

mysql> select * from employees;
+--------+----------+------------+----------+------------+-----------+
| emp_id | emp_name | department | salary   | experience | city      |
+--------+----------+------------+----------+------------+-----------+
|    101 | Rahul    | IT         | 65000.00 |          5 | Hyderabad |
|    102 | Priya    | HR         | 45000.00 |          3 | Chennai   |
|    103 | Amit     | Finance    | 70000.00 |          6 | Bangalore |
|    104 | Sneha    | IT         | 80000.00 |          8 | Hyderabad |
|    105 | Kiran    | Sales      | 40000.00 |          2 | Pune      |
+--------+----------+------------+----------+------------+-----------+
5 rows in set (0.00 sec)

mysql> select * from employee_audit;
Empty set (0.00 sec)

mysql> DELIMITER //
mysql> CREATE TRIGGER trg_before_after_salary
    -> BEFORE INSERT
    -> ON EMPLOYEES
    -> FOR EACH ROW
    -> BEGIN
    -> IF NEW.SALARY<20000 THEN
    -> SIGNAL SQLSTATE '45000'
    -> SET MESSAGE_TEXT = 'SALARY CANNOT BE LESS THAN 20000';
    -> END IF;
    -> END //
Query OK, 0 rows affected (0.02 sec)

mysql> DELIMITER ;
mysql> INSERT INTO EMPLOYEES VALUES(106,'ARJUN','IT',15000,3,'VIZAG');
ERROR 1644 (45000): SALARY CANNOT BE LESS THAN 20000
mysql> SHOW TRIGGERS;
+-------------------------+--------+-----------+---------------------------------------------------------------------------------------------------------------------------+--------+------------------------+-----------------------------------------------------------------------------------------------------------------------+----------------+----------------------+----------------------+--------------------+
| Trigger                 | Event  | Table     | Statement                                                                                                                 | Timing | Created                | sql_mode                                                                                                              | Definer        | character_set_client | collation_connection | Database Collation |
+-------------------------+--------+-----------+---------------------------------------------------------------------------------------------------------------------------+--------+------------------------+-----------------------------------------------------------------------------------------------------------------------+----------------+----------------------+----------------------+--------------------+
| trg_before_after_salary | INSERT | employees | BEGIN
IF NEW.SALARY<20000 THEN
SIGNAL SQLSTATE '45000'
SET MESSAGE_TEXT = 'SALARY CANNOT BE LESS THAN 20000';
END IF;
END | BEFORE | 2026-08-05 10:39:26.62 | ONLY_FULL_GROUP_BY,STRICT_TRANS_TABLES,NO_ZERO_IN_DATE,NO_ZERO_DATE,ERROR_FOR_DIVISION_BY_ZERO,NO_ENGINE_SUBSTITUTION | root@localhost | utf8mb4              | utf8mb4_0900_ai_ci   | utf8mb4_0900_ai_ci |
+-------------------------+--------+-----------+---------------------------------------------------------------------------------------------------------------------------+--------+------------------------+-----------------------------------------------------------------------------------------------------------------------+----------------+----------------------+----------------------+--------------------+
1 row in set (0.01 sec)

mysql> DELIMITER //
mysql> CREATE TRIGGER trg_before_insert_uppercase
    -> BEFORE INSERT
    -> ON EMPLOYEES
    -> FOR EACH ROW
    -> BEGIN
    -> set NEW.EMP_NAME = UPPER(NEW.EMP_NAME);
    -> END //
Query OK, 0 rows affected (0.02 sec)

mysql> DELIMITER ;
mysql> INSERT INTO EMPLOYEES VALUES(106,'ARJUn','IT',30000,3,'VIZAG');
Query OK, 1 row affected (0.01 sec)

mysql> select * from employees;
+--------+----------+------------+----------+------------+-----------+
| emp_id | emp_name | department | salary   | experience | city      |
+--------+----------+------------+----------+------------+-----------+
|    101 | Rahul    | IT         | 65000.00 |          5 | Hyderabad |
|    102 | Priya    | HR         | 45000.00 |          3 | Chennai   |
|    103 | Amit     | Finance    | 70000.00 |          6 | Bangalore |
|    104 | Sneha    | IT         | 80000.00 |          8 | Hyderabad |
|    105 | Kiran    | Sales      | 40000.00 |          2 | Pune      |
|    106 | ARJUN    | IT         | 30000.00 |          3 | VIZAG     |
+--------+----------+------------+----------+------------+-----------+
6 rows in set (0.00 sec)

mysql> INSERT INTO EMPLOYEES VALUES(106,'arjun','IT',30000,3,'VIZAG');
ERROR 1062 (23000): Duplicate entry '106' for key 'employees.PRIMARY'
mysql> DELIMITER //
mysql> CREATE TRIGGER trg_before_insert_upper
    -> BEFORE INSERT
    -> ON EMPLOYEES
    -> FOR EACH ROW
    -> set NEW.EMP_NAME = UPPER(NEW.EMP_NAME);
    -> END //
Query OK, 0 rows affected (0.01 sec)

ERROR 1064 (42000): You have an error in your SQL syntax; check the manual that corresponds to your MySQL server version for the right syntax to use near 'END' at line 1
mysql> CREATE TRIGGER trg_before_insert_upper
    -> BEFORE INSERT
    -> ON EMPLOYEES
    -> FOR EACH ROW
    -> FOR EACH ROW
    -> ^C
mysql> CREATE TRIGGER trg_before_insert_upper
    -> BEFORE INSERT
    -> ON EMPLOYEES
    -> FOR EACH ROW
    -> BEGIN
    -> set NEW.EMP_NAME = UPPER(NEW.EMP_NAME);
    -> END //
ERROR 1359 (HY000): Trigger already exists
mysql> drop trigger trg_before_insert_upper;
    -> delimiter ;
    -> ^C
mysql> delimiter ;
mysql> drop trigger trg_before_insert_upper;
Query OK, 0 rows affected (0.01 sec)

mysql> DELIMITER //
mysql> CREATE TRIGGER trg_before_insert_upper
    -> BEFORE INSERT
    -> ON EMPLOYEES
    -> FOR EACH ROW
    -> BEGIN
    -> set NEW.EMP_NAME = UPPER(NEW.EMP_NAME);
    -> END //
Query OK, 0 rows affected (0.01 sec)

mysql> INSERT INTO EMPLOYEES VALUES(106,'ARJUn','IT',30000,3,'VIZAG');
    -> ^C
mysql> delimiter ;
mysql> INSERT INTO EMPLOYEES VALUES(106,'ARJUn','IT',30000,3,'VIZAG');
ERROR 1062 (23000): Duplicate entry '106' for key 'employees.PRIMARY'